{
  "project": "AI睡眠音箱",
  "date": "2026-05-17",
  "quantity": "2000套",
  "total_quantity": "2000",
  "batch_quantity": "2000",
  "versions": [
    "经济版",
    "标准版",
    "高性能版"
  ],
  "selected_version": "经济版",
  "ai_suggestion": "推荐标准版：WiFi+BLE双模+双麦降噪+呼吸灯+5W功放，满足睡前故事/白噪音/语音点播核心场景，成本比高性能版低约30%，用户体验完整。",
  "risk_tags": [
    {
      "tag": "ESP32-WROOM-02库存紧张",
      "level": "mid",
      "desc": "经济版模组在部分商家库存仅2片，建议确认长线供货渠道"
    },
    {
      "tag": "儿童产品合规认证",
      "level": "high",
      "desc": "FCC/CE认证必须，WiFi/BLE模组需选用已获FCC ID的成品模组（ESP32系列已通过FCC），扬声器需符合EN71儿童玩具安全标准"
    },
    {
      "tag": "光纤传感器选型",
      "level": "mid",
      "desc": "MAX30102模组价格波动大，¥4.45-22.4差异显著，需锁定2000套批量采购渠道"
    },
    {
      "tag": "OLED显示缺货",
      "level": "mid",
      "desc": "华秋无货，AI搜索结果为美元计价，2000套需确认CNY渠道避免汇损"
    },
    {
      "tag": "WS2812B库存",
      "level": "low",
      "desc": "华秋商城WS2812B库存为0，需备选商家或选用国产SK6812替代"
    }
  ],
  "items": [
    {
      "id": 1,
      "category": "WiFi+BLE模组",
      "is_variant": true,
      "func_impact": "主控通信",
      "exp_impact": "AI响应速度",
      "user_value": "高",
      "cost_tier": "high",
      "note": "ESP32系列内置WiFi+BLE+Flash+PSRAM，无需外挂MCU",
      "variants": [
        {
          "version": "经济版",
          "brand": "乐鑫(Espressif)",
          "package": "SMD-38",
          "part_number": "ESP32-C3-WROOM-02-N4",
          "description": "RISC-V, WiFi 4+BLE 5.0, 4MB Flash, 内置WiFi/BLE, 125°C",
          "price_mall": 18.89,
          "mall_source": "华秋商城",
          "mall_url": "https://www.hqchip.com/search.html?keyword=ESP32-C3-WROOM-1",
          "price_ai": 20.0,
          "ai_source": "博查",
          "found": true,
          "price_unit": 18.89,
          "cost_ratio": 0.1
        },
        {
          "version": "标准版",
          "brand": "乐鑫(Espressif)",
          "package": "SMD-38",
          "part_number": "ESP32-S3-WROOM-1-N8R2",
          "description": "Xtensa双核, WiFi+BLE 5.0, 8MB Flash+2MB PSRAM, AI加速指令",
          "price_mall": 22.61,
          "mall_source": "华秋商城",
          "mall_url": "https://www.hqchip.com/search.html?keyword=ESP32-S3-WROOM-1",
          "price_ai": 22.61,
          "ai_source": "华秋商城",
          "found": true,
          "price_unit": 22.61,
          "cost_ratio": 0.2
        },
        {
          "version": "高性能版",
          "brand": "乐鑫(Espressif)",
          "package": "SMD-38",
          "part_number": "ESP32-S3-WROOM-1U-N16R8",
          "description": "Xtensa双核, WiFi+BLE 5.0, 16MB Flash+8MB PSRAM, 强AI处理",
          "price_mall": 22.61,
          "mall_source": "华秋商城",
          "mall_url": "https://www.hqchip.com/search.html?keyword=ESP32-S3-WROOM-1",
          "price_ai": 22.61,
          "ai_source": "华秋商城",
          "found": true,
          "price_unit": 22.61,
          "cost_ratio": 0.2
        }
      ]
    },
    {
      "id": 2,
      "category": "外挂PSRAM",
      "is_variant": true,
      "func_impact": "AI并发处理",
      "exp_impact": "响应流畅",
      "user_value": "高",
      "cost_tier": "mid",
      "note": "仅高性能版外挂PSRAM，标准/经济版使用模组内置PSRAM",
      "variants": [
        {
          "version": "经济版",
          "brand": "-",
          "package": "-",
          "part_number": "模组内置",
          "description": "ESP32-C3-WROOM-02-N4 内置，无需外挂",
          "price_mall": 0,
          "mall_source": "",
          "mall_url": "",
          "price_ai": 0,
          "ai_source": "",
          "found": true,
          "price_unit": 0,
          "cost_ratio": 0.0
        },
        {
          "version": "标准版",
          "brand": "-",
          "package": "-",
          "part_number": "模组内置",
          "description": "ESP32-S3-WROOM-1-N8R2 内置2MB PSRAM",
          "price_mall": 0,
          "mall_source": "",
          "mall_url": "",
          "price_ai": 0,
          "ai_source": "",
          "found": true,
          "price_unit": 0,
          "cost_ratio": 0.0
        },
        {
          "version": "高性能版",
          "brand": "乐鑫(Espressif)",
          "package": "SMD-8",
          "part_number": "ESP-PSRAM8H",
          "description": "8MB HSPI PSRAM, 3.3V, 兼容ESP32-S3",
          "price_mall": null,
          "mall_source": "",
          "mall_url": "",
          "price_ai": 8.0,
          "ai_source": "博查",
          "found": true,
          "price_unit": 8.0,
          "cost_ratio": 0.1
        }
      ]
    },
    {
      "id": 3,
      "category": "麦克风",
      "is_variant": true,
      "func_impact": "语音识别",
      "exp_impact": "唤醒灵敏度",
      "user_value": "高",
      "cost_tier": "mid",
      "note": "双麦克风+阵列算法实现降噪，标准版以上才配置",
      "variants": [
        {
          "version": "经济版",
          "brand": "敏芯微(MEMSensing)",
          "package": "SMD-4",
          "part_number": "MSA4211RL",
          "description": "模拟MEMS麦克风, -26dB, 63dB SNR, 单麦",
          "price_mall": 1.5,
          "mall_source": "博查",
          "mall_url": "",
          "price_ai": 1.5,
          "ai_source": "博查",
          "found": true,
          "price_unit": 1.5,
          "cost_ratio": 0.0
        },
        {
          "version": "标准版",
          "brand": "敏芯微(MEMSensing)",
          "package": "SMD-4",
          "part_number": "MSM4211RL",
          "description": "数字MEMS麦克风, I2S输出, -26dB, 双麦降噪阵列",
          "price_mall": 3.5,
          "mall_source": "博查",
          "mall_url": "",
          "price_ai": 3.5,
          "ai_source": "博查",
          "found": true,
          "price_unit": 3.5,
          "cost_ratio": 0.0
        },
        {
          "version": "高性能版",
          "brand": "楼氏电子(Knowles)",
          "package": "SMD-4",
          "part_number": "SPH0645LM4H",
          "description": "数字MEMS, I2S, -26dB, 64dB SNR, 低功耗, 双麦阵列",
          "price_mall": 8.0,
          "mall_source": "博查",
          "mall_url": "",
          "price_ai": 8.0,
          "ai_source": "博查",
          "found": true,
          "price_unit": 8.0,
          "cost_ratio": 0.1
        }
      ]
    },
    {
      "id": 4,
      "category": "音频功放",
      "is_variant": true,
      "func_impact": "音质输出",
      "exp_impact": "音量音质",
      "user_value": "高",
      "cost_tier": "mid",
      "note": "D类功放效率>85%，儿童睡眠场景注意音量限制",
      "variants": [
        {
          "version": "经济版",
          "brand": "DIODES",
          "package": "SOT-23-5",
          "part_number": "PAM8301AAF",
          "description": "D类单声道, 3W, 5V, 效率90%, 低EMI",
          "price_mall": 2.62,
          "mall_source": "华秋商城",
          "mall_url": "https://www.hqchip.com/search.html?keyword=PAM8301",
          "price_ai": 2.62,
          "ai_source": "华秋商城",
          "found": true,
          "price_unit": 2.62,
          "cost_ratio": 0.0
        },
        {
          "version": "标准版",
          "brand": "Nsiway",
          "package": "SOP-8",
          "part_number": "NS4150C",
          "description": "D类单声道, 5W, 5V, 效率85%, 低EMI",
          "price_mall": 0.93,
          "mall_source": "华秋商城",
          "mall_url": "https://www.hqchip.com/search.html?keyword=NS4150",
          "price_ai": 0.93,
          "ai_source": "华秋商城",
          "found": true,
          "price_unit": 0.93,
          "cost_ratio": 0.0
        },
        {
          "version": "高性能版",
          "brand": "芯之勋(Chipstar)",
          "package": "SOP-8",
          "part_number": "CS8122S",
          "description": "D类单声道, 5W, 5V, 超低EMI, 输出短路保护",
          "price_mall": null,
          "mall_source": "",
          "mall_url": "",
          "price_ai": 2.0,
          "ai_source": "博查",
          "found": true,
          "price_unit": 2.0,
          "cost_ratio": 0.0
        }
      ]
    },
    {
      "id": 5,
      "category": "扬声器",
      "is_variant": true,
      "func_impact": "音频输出",
      "exp_impact": "音质体验",
      "user_value": "高",
      "cost_tier": "high",
      "note": "儿童安全要求：无尖刺外壳，最大音量限制保护听力，所有版本须通过EN71认证",
      "variants": [
        {
          "version": "经济版",
          "brand": "国产(声悦/特宇)",
          "package": "插件-圆盆",
          "part_number": "1.5寸 3W 4Ω 全频",
          "description": "1.5寸 3W 4Ω 全频扬声器, ABS盆架, 儿童安全外壳",
          "price_mall": 3.0,
          "mall_source": "博查",
          "mall_url": "",
          "price_ai": 3.0,
          "ai_source": "博查",
          "found": true,
          "price_unit": 3.0,
          "cost_ratio": 0.0
        },
        {
          "version": "标准版",
          "brand": "国产(声悦/特宇)",
          "package": "插件-圆盆",
          "part_number": "2寸 4W 4Ω 全频",
          "description": "2寸 4W 4Ω 全频扬声器, ABS盆架, 儿童安全外壳",
          "price_mall": 5.0,
          "mall_source": "博查",
          "mall_url": "",
          "price_ai": 5.0,
          "ai_source": "博查",
          "found": true,
          "price_unit": 5.0,
          "cost_ratio": 0.0
        },
        {
          "version": "高性能版",
          "brand": "国产(歌尔/瑞声)",
          "package": "插件-圆盆",
          "part_number": "2.5寸 5W 4Ω 全频 + 无源低音辐射器",
          "description": "2.5寸 5W 4Ω 全频+无源低音辐射器, ABS盆架, 高保真",
          "price_mall": 10.0,
          "mall_source": "博查",
          "mall_url": "",
          "price_ai": 10.0,
          "ai_source": "博查",
          "found": true,
          "price_unit": 10.0,
          "cost_ratio": 0.1
        }
      ]
    },
    {
      "id": 6,
      "category": "充电管理",
      "is_variant": true,
      "func_impact": "电源管理",
      "exp_impact": "续航安全",
      "user_value": "高",
      "cost_tier": "mid",
      "note": "含锂电池备电，USB-C接口，需通过FCC/CE安全认证",
      "variants": [
        {
          "version": "经济版",
          "brand": "UMW",
          "package": "SOP-8",
          "part_number": "TP4056",
          "description": "线性锂电充电IC, 1A, USB-C输入, 带保护",
          "price_mall": 0.42,
          "mall_source": "华秋商城",
          "mall_url": "https://www.hqchip.com/search.html?keyword=TP4056",
          "price_ai": 0.42,
          "ai_source": "华秋商城",
          "found": true,
          "price_unit": 0.42,
          "cost_ratio": 0.0
        },
        {
          "version": "标准版",
          "brand": "英集芯(injoinic)",